category,page,text,label
Life Science,Biostimulation,"Biostimulation involves the modification of the environment to stimulate existing bacteria capable of bioremediation.  This can be done by addition of various forms of rate limiting nutrients and electron acceptors, such as phosphorus, nitrogen, oxygen, or carbon (e.g. in the form of molasses).  Alternatively, remediation of halogenated contaminants in anaerobic environments may be stimulated by adding electron donors (organic substrates), thus allowing indigenous microorganisms to use the halogenated contaminants as electron acceptors. EPA Anaerobic Bioremediation Technologies Additives are usually added to the subsurface through injection wells, although injection well technology for biostimulation purposes is still emerging.  Removal of the contaminated material is also an option, albeit an expensive one.  Biostimulation can be enhanced by bioaugmentation.  This process, overall, is referred to as bioremediation and is an EPA-approved method for reversing the presence of oil or gas spills.  While biostimulation is usually associated with remediation of hydrocarbon or high production volume chemical spills, it is also potentially useful for treatment of less frequently encountered contaminant spills, such as pesticides, particularly herbicides.The primary advantage of biostimulation is that bioremediation will be undertaken by already present native microorganisms that are well-suited to the subsurface environment, and are well distributed spatially within the subsurface.  The primary disadvantage is that the delivery of additives in a manner that allows the additives to be readily available to subsurface microorganisms is based on the local geology of the subsurface.  Tight, impermeable subsurface lithology (tight clays or other fine-grained material) make it difficult to spread additives throughout the affected area.  Fractures in the subsurface create preferential pathways in the subsurface which additives preferentially follow, preventing even distribution of additives.
Recently a number of products have been introduced which allow popular use of bioremediation using biostimulative methods.  They may harness local bacteria using biostimulation by creating a hospitable environment for hydrocarbon-devouring microorganisms, or they may introduce foreign bacteria into the environment as a direct application to the hydrocarbon.  While the jury is out as to whether either is particularly more effective than the other, prima facie consideration suggests the introduction of foreign bacteria to any environment stands a chance of mutating organisms already present and affecting the biome.
Investigations to determine subsurface characteristics (such as natural groundwater velocity during ambient conditions, hydraulic conductivity of the subsurface, and lithology of the subsurface) are important in developing a successful biostimulation system.  In addition, a pilot-scale study of the potential biostimulation system should be undertaken prior to full-scale design and implementation.
However, some biostimulative agents may be used in chaotic surfaces such as open water and sand so long as they are [oleophilic], meaning that they bond exclusively to hydrocarbons, and basically sink in the water column, bonding to oil, where they then float to the water's surface, exposing the hydrocarbon to more abundant sunlight and oxygen where greater micro-organic aerobic activity can be encouraged.  Some consumer-targeted biostimulants bond possess this quality, others do not.",1
Life Science,Merodiploid,"A merodiploid is a partially diploid bacterium, which has its own chromosome complement and a chromosome fragment introduced by conjugation, transformation or transduction. It can also be defined as an essentially haploid organism that carries a second copy of a part of its genome. The term is derived from the Greek, meros = part, and was originally used to describe both unstable partial diploidy, such as that which occurs briefly in recipients after mating with an Hfr strain (1), and the stable state, exemplified by F-prime strains (see Hfr'S And F-Primes). Over time the usage has tended to confine the term to descriptions of stable genetic states. Merodiploidy refers to the partial duplication of chromosomes in a haploid organism.",1
Life Science,Integrated fluidic circuit,Integrated fluidic circuit (IFC) is a type of integrated circuit (IC) using fluids.,1
Life Science,Human genetic enhancement,"Human genetic enhancement or human genetic engineering refers to human enhancement by means of a genetic modification. This could be done in order to cure diseases (gene therapy), prevent the possibility of getting a particular disease (similarly to vaccines),  to improve athlete performance in sporting events (gene doping), or to change physical appearance, metabolism, and even improve physical capabilities and mental faculties such as memory and intelligence.
These genetic enhancements may or may not be done in such a way that the change is heritable (which has raised concerns within the scientific community).

",1
Life Science,Stercomata,"Stercomata (or stercomes) are extracellular pellets of waste material produced by some groups of foraminiferans, including xenophyophoreans and komokiaceans, Gromia, and testate amoebae. The pellets are ovoid (egg-shaped), brownish in color, and on average measure from 10-20 µm in length. Stercomata are composed of small mineral grains and undigested waste products held together by strands of glycosaminoglycans.The term “sterkome” was first used Schaudinn in 1899 to describe the balls of undigested food remains produced by the testate amoeba Trichosphaerium sieboldi, the foraminiferan Saccammina sphaerica, and the gromiid Gromia dujardinii. Schaudinn conducted feeding experiments on live individuals of Trichosphaerium sieboldi kept in culture dishes to confirm that stercomata were accumulations of waste material produced as a byproduct of feeding.

",1
Life Science,Primer dimer,"A primer dimer (PD) is a potential by-product in the polymerase chain reaction (PCR), a common biotechnological method. As its name implies, a PD consists of two primer molecules that have attached (hybridized) to each other because of strings of complementary bases in the primers. As a result, the DNA polymerase amplifies the PD, leading to competition for PCR reagents, thus potentially inhibiting amplification of the DNA sequence targeted for PCR amplification. In quantitative PCR, PDs may interfere with accurate quantification.

",1
Life Science,Polyphosphate-accumulating organisms,"Polyphosphate-accumulating organisms (PAOs) are a group of bacteria that, under certain conditions, facilitate the removal of large amounts of phosphorus from wastewater in a process, called enhanced biological phosphorus removal (EBPR). PAOs accomplish this removal of phosphate by accumulating it within their cells as polyphosphate.
PAOs are by no means the only bacteria that can accumulate polyphosphate within their cells and in fact, the production of polyphosphate is a widespread ability among bacteria.  However, the PAOs have many characteristics that other organisms that accumulate polyphosphate do not have, that make them amenable to use in wastewater treatment.  Specifically, this is the ability to consume simple carbon compounds (energy source) without the presence of an external electron acceptor (such as nitrate or oxygen) by generating energy from internally stored polyphosphate and glycogen.  Most other bacteria cannot consume under these conditions and therefore PAOs gain a selective advantage within the mixed microbial community present in the activated sludge. Therefore, wastewater treatment plants that operate for enhanced biological phosphorus removal have an anaerobic tank (where there is no nitrate or oxygen present as external electron acceptor) prior to the other tanks to give PAOs preferential access to the simple carbon compounds in the wastewater that is influent to the plant.
A PAO related to the Betaproteobacteria has been identified and named Candidatus Accumulibacter Phosphatis.  Accumulibacter has been shown to remove phosphorus from EBPR plants in Australia, Europe and the USA. It can consume a range of carbon compounds, such as acetate and propionate, under anaerobic conditions and store these compounds as polyhydroxyalkanoates (PHA) which it consumes as a carbon and energy source for growth using oxygen or nitrate as electron acceptor.
Recently, another PAO related to the Actinobacteria has been identified in wastewater treatment plants. These organisms appear to be limited to certain amino acids as carbon and energy source.  The storage compound that they use to store the amino acids that these organisms take up under anaerobic conditions has not been identified. These bacteria have been observed in some EBPR plants in Denmark (where they were discovered) but their wider distribution is unknown.",1
Life Science,Pegol,"Certolizumab pegol, sold under the brand name Cimzia, is a biologic medication for the treatment of Crohn's disease, rheumatoid arthritis, psoriatic arthritis and ankylosing spondylitis. It is a fragment of a monoclonal antibody specific to tumor necrosis factor alpha (TNF-α) and is manufactured by UCB.It is on the World Health Organization's List of Essential Medicines.",1
Life Science,Sotio,"SOTIO Biotech is a Czech biotechnology company focused on clinical-stage research and development of innovative medicines for cancer with operations in Europe, North America, and Asia. The company has clinical programs which include a superagonist of the immuno-oncology target IL-15, a new generation of potent and stable antibody-drug conjugates (ADCs), proprietary technology designed to improve on the efficacy of CAR T therapies and a platform to streamline and enhance personalized cell therapies.

",1
Life Science,Somatic embryogenesis,"Somatic embryogenesis is an artificial process in which a plant or embryo is derived from a single somatic cell. Somatic embryos are formed from plant cells that are not normally involved in the development of embryos, i.e. ordinary plant tissue. No endosperm or seed coat is formed around a somatic embryo.
Cells derived from competent source tissue are cultured to form an undifferentiated mass of cells called a callus. Plant growth regulators in the tissue culture medium can be manipulated to induce callus formation and subsequently changed to induce embryos to form the callus. The ratio of different plant growth regulators required to induce callus or embryo formation varies with the type of plant. Somatic embryos are mainly produced in vitro and for laboratory purposes, using either solid or liquid nutrient media which contain plant growth regulators (PGR’s). The main PGRs used are auxins but can contain cytokinin in a smaller amount. Shoots and roots are monopolar while somatic embryos are bipolar, allowing them to form a whole plant without culturing on multiple media types. Somatic embryogenesis has served as a model to understand the physiological and biochemical events that occur during plant developmental processes as well as a component to biotechnological advancement. The first documentation of somatic embryogenesis was by Steward et al. in 1958 and Reinert in 1959 with carrot cell suspension cultures.",1
Life Science,Suppression subtractive hybridization,"Subtractive hybridization is a technology that allows for PCR-based amplification of only cDNA fragments that differ between a control (driver) and experimental transcriptome. cDNA is produced from mRNA.  Differences in relative abundance of transcripts are highlighted, as are genetic differences between species.  The technique relies on the removal of dsDNA formed by hybridization between a control and test sample, thus eliminating cDNAs or gDNAs of similar abundance, and retaining differentially expressed, or variable in sequence, transcripts or genomic sequences.
Suppression subtractive hybridization has also been successfully used to identify strain- or species-specific DNA sequences in a variety of bacteria including Vibrio species (Metagenomics).",1
Life Science,Competitions and prizes in biotechnology,There exist a number of competitions and prizes to reward distinguished contributions and to encourage developments in biotechnology.,1
Life Science,Protein precipitation,"Protein precipitation is widely used in downstream processing of biological products in order to concentrate proteins and purify them from various contaminants. For example, in the biotechnology industry protein precipitation is used to eliminate contaminants commonly contained in blood. The underlying mechanism of precipitation is to alter the solvation potential of the solvent, more specifically, by lowering the solubility of the solute by addition of a reagent.

",1
Life Science,Body capacitance,"Body capacitance is the physical property of the human body that has it act as a capacitor. Like any other electrically-conductive object, a human body can store electric charge if insulated. The actual amount of capacitance varies with the surroundings; it would be low when standing on top of a pole with nothing nearby, but high when leaning against an insulated, but grounded large metal surface, such as a household refrigerator, or a metal wall in a factory.",1
Life Science,Tellurium ion resistance,The Tellurium Ion Resistance (TerC) Family (TC# 2.A.109) is part of the Lysine Exporter (LysE) Superfamily. A representative list of proteins belonging to the TerC family can be found in the Transporter Classification Database.,1
Life Science,Single-nucleotide polymorphism,"In genetics, a single-nucleotide polymorphism (SNP ; plural SNPs ) is a germline substitution of a single nucleotide at a specific position in the genome. Although certain definitions require the substitution to be present in a sufficiently large fraction of the population (e.g. 1% or more), many publications do not apply such a frequency threshold.
For example, at a specific base position in the human genome, the G nucleotide may appear in most individuals, but in a minority of individuals, the position is occupied by an A. This means that there is a SNP at this specific position, and the two possible nucleotide variations – G or A – are said to be the alleles for this specific position.SNPs pinpoint differences in our susceptibility to a wide range of diseases, for example age-related macular degeneration (a common SNP in the CFH gene is associated with increased risk of the disease) or nonalcoholic fatty liver disease (a SNP in the PNPLA3 gene is associated with increased risk of the disease). The severity of illness and the way the body responds to treatments are also manifestations of genetic variations caused by SNPs. For example, the APOE E4 allele that is determined by two common SNPs, rs429358 and rs7412, in the APOE gene is not only associated with increased risk for Alzheimer’s disease but also younger age at onset of the disease.A single-nucleotide variant (SNV) is a general term for single nucleotide change in DNA sequence. So a SNV can be a common SNP or a rare mutation, and can be germline or somatic and can be caused by cancer, but a SNP has to segregate in a species' population of organisms. SNVs also commonly arise in molecular diagnostics such as designing PCR primers to detect viruses, in which the viral RNA or DNA sample may contain SNVs.",1
Life Science,Phosphoproteomics,"Phosphoproteomics is a branch of proteomics that identifies, catalogs, and characterizes proteins containing a phosphate group as a posttranslational modification.  Phosphorylation is a key reversible modification that regulates protein function, subcellular localization, complex formation, degradation of proteins and therefore cell signaling networks.  With all of these modification results, it is estimated that between 30%–65% of all proteins may be phosphorylated, some multiple times. Based on statistical estimates from many datasets, 230,000, 156,000 and 40,000 phosphorylation sites should exist in human, mouse, and yeast, respectively.Compared to expression analysis, phosphoproteomics provides two additional layers of information.  First, it provides clues on what protein or pathway might be activated because a change in phosphorylation status almost always reflects a change in protein activity.  Second, it indicates what proteins might be potential drug targets as exemplified by the kinase inhibitor Gleevec.  While phosphoproteomics will greatly expand knowledge about the numbers and types of phosphoproteins, its greatest promise is the rapid analysis of entire phosphorylation based signalling networks.",1
Life Science,Synchronous coefficient of drag alteration,"Synchronous coefficient of drag alteration (SCODA) is a biotechnology method for purifying, separating and/or concentrating bio-molecules. SCODA has the ability to separate molecules whose mobility (or drag) can be altered in sync with a driving field. This technique has been primarily used for concentrating and purifying DNA, where DNA mobility changes with an applied electrophoretic field. Electrophoretic SCODA has also been demonstrated with RNA and proteins.",1
Life Science,NAIL-MS,"NAIL-MS (short for nucleic acid isotope labeling coupled mass spectrometry) is a technique based on mass spectrometry used for the investigation of nucleic acids and its modifications. It enables a variety of experiment designs to study the underlying mechanism of RNA biology in vivo. For example, the dynamic behaviour of nucleic acids in living cells, especially of RNA modifications, can be followed in more detail.",1
Life Science,Tokogeny,"Tokogeny or tocogeny is the biological relationship between parent and offspring, or more generally between ancestors and descendants.  In contradistinction to phylogeny it applies to individual organisms as opposed to species.
In the tokogentic system shared characteristics are called traits.",1
Business Administration,Disagree and commit,"Disagree and commit is a management principle which states that individuals are allowed to disagree while a decision is being made, but that once a decision has been made, everybody must commit to it. The principle can also be understood as a statement about when it is useful to have conflict and disagreement, with the principle saying disagreement is useful in early states of decision-making while harmful after a decision has been made. Disagree and commit is a method of avoiding the consensus trap, in which the lack of consensus leads to inaction.",0
Business Administration,Power structure,"In political sociology, but also operative within the rest of the animal kingdom, a power structure is a hierarchy of competence or aggression (might) predicated on influence between an individual and other entities in a group. A power structure focuses on the way power and authority is related between people within groups such as a government, nation, institution, organization, or a society. Such structures are of interest to various fields, including sociology, government, economics, and business. A power structure may be formal and intentionally constructed to maximize values like fairness or efficiency, as in a hierarchical organization wherein every entity, except one, is subordinate to a single other entity. Conversely, a power structure may be an informal set of roles, such as those found in a dominance hierarchy in which members of a social group interact, often aggressively, to create a ranking system. A culture that is organised in a dominance hierarchy is a dominator culture, the opposite of an egalitarian culture of partnership. A visible, dominant group or elite that holds power or authority within a power structure is often referred to as being the Establishment. Power structures are fluid, with changes occurring constantly, either slowly or rapidly, evolving or revolutionary, peacefully or violently.",0
Business Administration,Company code of conduct,"A code of conduct is a set of rules outlining the norms, rules, and responsibilities or proper practices of an individual party or an organization.",0
Business Administration,Supervision,"Supervision is an act or instance of directing, managing, or oversight.

",0
Business Administration,Peopleware,"Peopleware is a term used to refer to one of the three core aspects of computer technology, the other two being hardware and software. Peopleware can refer to anything that has to do with the role of people in the development or use of computer software and hardware systems, including such issues as developer productivity, teamwork, group dynamics, the psychology of programming, project management, organizational factors, human interface design, and human–machine interaction.",0
Business Administration,Target culture,"Target culture is a pejorative term used to refer to the perceived negative effects of rigid adherence to performance targets by businesses and organisations. The term is primarily used to refer to this kind of behaviour within the provision of public services in the United Kingdom. Target culture often stems from not being able to accurately measure a broad social good like health, education or crime prevention: instead, specific target like increasing the number of people passing an examination  or the number of arrests made by a police force is used.",0
Business Administration,OSTO System Model,"The OSTO System Model is based on the OSTO System Theory, which comprehends complex systems and organizations as living systems and maps these by means of the OSTO System Model. The model is cybernetic in nature and is deduced from the theory of closed loops. The basics of this theory have been formulated by David P. Hanna in the 1980s and have been published initially in 1988. The model assumes that several central transformation processes take place on the inside of a complex organization. These are deeply influenced by mutual reactions between the inner life of the organization and the outside (environment). In terms of closed loop theory, the OSTO System Model depicts the essential elements of such a living system in its interconnectedness, dependencies, and reciprocal reactions. Thinking in network structures is, thus, a crucial part of the OSTO System Theory.
The acronym “OSTO” stands for open, sociotechnical, economic (German: “oekonomisch”)  aspects of a system. With regard to organizations and economically working companies, the model takes into consideration the openness of systems towards their environments as well as the fact that they are multidimensional, socio-techno-economic structures. Taking into consideration these four aspects, the model displays the complexity of such a system in its numerous dimensions.",0
Business Administration,Incremental profit,"Incremental profit is the profit gain or loss associated with a given managerial decision. Total profit increases so long as incremental profit is positive. When incremental profit is negative, total profit declines. Similarly, incremental profit is positive (and total profit increases) if the incremental revenue associated with a decision exceeds the incremental cost. The incremental concept is so intuitively obvious that it is easy to overlook both its significance in managerial decision making and the potential for difficulty in correctly applying it.
For this reason, the incremental concept is sometimes violated in practice. For example, a firm may refuse to sublet excess warehouse space for $5000 per month because it figures its cost as $7500 per month -a price paid for a long-term lease on the facility. However, if the warehouse space represents excess capacity with no current value to the company, its historical cost of $7500 per month is irrelevant and should be disregarded. The firm would forego $5000 in profits by turning down the offer to sublet the excess warehouse space. Similarly, any firm that adds a standard allocated charge for fixed costs and overhead to the true incremental cost of production runs the risk of turning down profitable business.",0
Business Administration,Palladium International,"Palladium (also known as ""The Palladium Group"", ""Palladium Holdings"" or ""Palladium International"") is an international advisory and management company representing the combination of seven prior companies: GRM International, Futures Group, Palladium, the IDL Group, Development & Training Services, HK Logistics and CARANA Corporation. As of October 2016, Palladium employs over 2,500 persons operating in 90 countries. At the end of 2015, Palladium International was the fourth-largest private sector partner for the UK Government's Department for International Development (DFID). During 2011, Palladium International members Futures Group and Carana were USAID's fourteenth and sixteenth largest private sector partners, respectively. At the end of 2012, GRM International was the third largest private sector partner for AusAID.",0
Business Administration,Registered office,"A registered office is the official address of an incorporated company, association or any other legal entity. Generally it will form part of the public record and is required in most countries where the registered organization or legal entity is incorporated. A registered physical office address is required for incorporated organizations to receive official correspondence and formal notices from government departments, investors, banks, shareholders and the general public.: 209 

",0
