category,page,text,label
Technology,Kernel density estimation,"In statistics, kernel density estimation (KDE) is a non-parametric way to estimate the probability density function of a random variable.  Kernel density estimation is a fundamental data smoothing problem where inferences about the population are made, based on a finite data sample. In some fields such as signal processing and econometrics it is also termed the Parzen–Rosenblatt window method,  after Emanuel Parzen and Murray Rosenblatt, who are usually credited with independently creating it in its current form. One of the famous applications of kernel density estimation is in estimating the class-conditional marginal densities of data when using a naive Bayes classifier, which can improve its prediction accuracy.",2
Technology,Anderson's rule (computer science),"In the field of computer security, Anderson's rule refers to a principle formulated by Ross J. Anderson: systems that handle sensitive personal information involve a trilemma of security, functionality and scale, of which you can choose any two. A system that has information on many data subjects and to which many people require access is hard to secure unless its functionality is severely restricted. If it has rich functionality, you may have to restrict the number of people with access, or accept that some information will leak.",2
Technology,Flow-based generative model,"A flow-based generative model is a generative model used in machine learning that explicitly models a probability distribution by leveraging normalizing flow, which is a statistical method using the change-of-variable law of probabilities to transform a simple distribution into a complex one.
The direct modeling of likelihood provides many advantages. For example, the negative log-likelihood can be directly computed and minimized as the loss function. Additionally, novel samples can be generated by sampling from the initial distribution, and applying the flow transformation.
In contrast, many alternative generative modeling methods such as variational autoencoder (VAE) and generative adversarial network do not explicitly represent the likelihood function.",2
Technology,Outline of computer security,"The following outline is provided as an overview of and topical guide to computer security:
Computer security is commonly known as security applied to computing devices such as computers and smartphones, as well as computer networks such as private and public networks, including the whole Internet.  The field covers all the processes and mechanisms by which digital equipment, information and services are protected from unintended or unauthorized access, change or destruction, and is of growing importance in line with the increasing reliance on computer systems of most societies worldwide. Computer security includes measures taken to ensure the integrity of files stored on a computer or server as well as measures taken to prevent unauthorized access to stored data, by securing the physical perimeter of the computer equipment, authentication of users or computer accounts accessing the data, and providing a secure method of data transmission.",2
Technology,List of datasets for machine-learning research,"These datasets are applied for machine learning research and have been cited in peer-reviewed academic journals. Datasets are an integral part of the field of machine learning. Major advances in this field can result from advances in learning algorithms (such as deep learning), computer hardware, and, less-intuitively, the availability of high-quality training datasets. High-quality labeled training datasets for supervised and semi-supervised machine learning algorithms are usually difficult and expensive to produce because of the large amount of time needed to label the data. Although they do not need to be labeled, high-quality datasets for unsupervised learning can also be difficult and costly to produce.

",2
Technology,Federal Desktop Core Configuration,"The Federal Desktop Core Configuration is a list of security settings recommended by the National Institute of Standards and Technology for general-purpose microcomputers that are connected directly to the network of a United States government agency.
The FDCC is a list of agreed upon Microsoft Windows operating system common core system functions, applications, files, and services that are changed in their configuration around which a framework for a more secure, and security-reliable MS Windows operating system was created. The standards were then made mandatory for every federal government computer effective Feb 1, 2008. If you wanted to connect to a federal office computer network your system had to meet or exceed the FDCC standard or you were denied access.
FDCC applied only to Windows XP and Vista desktop and laptop computers and was replaced by the United States Government Configuration Baseline (USGCB), which included settings for Windows 7 and Red Hat Enterprise Linux 5.
For Windows 7, the NIST changed the naming convention to the US Government Computer Baseline (USGCB ver 2.0). In addition to un-classifying a general Windows settings guide, the NIST also publishes guides specifically for Windows Firewall, Internet Explorer, and a guide (Vista-Energy, for example) created to capture settings that adhere to energy conservation policies.",2
Technology,Solomonoff's theory of inductive inference,"Solomonoff's theory of inductive inference is a mathematical proof that if a universe is generated by an algorithm, then observations of that universe, encoded as a dataset, are best predicted by the smallest executable archive of that dataset.  This formalization of Occam's razor  for induction was introduced by Ray Solomonoff, based on probability theory and theoretical computer science. In essence, Solomonoff's induction derives the posterior probability of any computable theory, given a sequence of observed data. This posterior probability is derived from Bayes rule and some universal prior, that is, a prior that assigns a positive probability to any computable theory.

",2
Technology,Genetic algorithm,"In computer science and operations research, a genetic algorithm (GA) is a metaheuristic inspired by the process of natural selection that belongs to the larger class of evolutionary algorithms (EA). Genetic algorithms are commonly used to generate high-quality solutions to optimization and search problems by relying on biologically inspired operators such as mutation, crossover and selection. Some examples of GA applications include optimizing decision trees for better performance, solving sudoku puzzles, hyperparameter optimization, etc.",2
Technology,Evolutionary programming,"Evolutionary programming is one of the four major evolutionary algorithm paradigms.  It is similar to genetic programming, but the structure of the program to be optimized is fixed, while its numerical parameters are allowed to evolve.
It was first used by Lawrence J. Fogel in the US in 1960 in order to use simulated evolution as a learning process aiming to generate artificial intelligence. Fogel used finite-state machines as predictors and evolved them.
Currently evolutionary programming is a wide evolutionary computing dialect with no fixed structure or (representation), in contrast with some of the other dialects. It has become harder to distinguish from evolutionary strategies.
Its main variation operator is mutation; members of the population are viewed as part of a specific species rather than members of the same species therefore each parent generates an offspring, using a (μ + μ) survivor selection.",2
Life Science,Genome mining,"Genome mining describes the exploitation of genomic information for the discovery of biosynthetic pathways of natural products and their possible interactions. It depends on computational technology and bioinformatics tools. The mining process relies on a huge amount of data (represented by DNA sequences and annotations) accessible in genomic databases. By applying data mining algorithms,  the data can be used to generate new knowledge in several areas of medicinal chemistry, such as discovering novel natural products.

",1
Life Science,Optoelectrowetting,"Optoelectrowetting (OEW) is a method of liquid droplet manipulation used in microfluidics applications. This technique builds on the principle of electrowetting, which has proven useful in liquid actuation due to fast switching response times and low power consumption. Where traditional electrowetting runs into challenges, however, such as in the simultaneous manipulation of multiple droplets, OEW presents a lucrative alternative that is both simpler and cheaper to produce. OEW surfaces are easy to fabricate, since they require no lithography, and have real-time, reconfigurable, large-scale manipulation control, due to its reaction to light intensity.",1
Life Science,Diploidization,Diploidization is the process of converting a polyploid genome back into a diploid one. Polyploidy is a product of whole genome duplication (WGD) and is followed by diploidization as a result of genome shock. The plant kingdom has undergone multiple events of polyploidization followed by diploidization in both ancient and recent lineages. It has also been hypothesized that vertebrate genomes have gone through two rounds of paleopolyploidy. The mechanisms of diploidization are poorly understood but patterns of chromosomal loss and evolution of novel genes are observed in the process.,1
Life Science,Bacteriophage,"A bacteriophage (), also known informally as a phage (), is a virus that infects and replicates within bacteria and archaea. The term was derived from ""bacteria"" and the Greek φαγεῖν (phagein), meaning ""to devour"". Bacteriophages are composed of proteins that encapsulate a DNA or RNA genome, and may have structures that are either simple or elaborate. Their genomes may encode as few as four genes (e.g. MS2) and as many as hundreds of genes. Phages replicate within the bacterium following the injection of their genome into its cytoplasm.
Bacteriophages are among the most common and diverse entities in the biosphere. Bacteriophages are ubiquitous viruses, found wherever bacteria exist. It is estimated there are more than 1031 bacteriophages on the planet, more than every other organism on Earth, including bacteria, combined. Viruses are the most abundant biological entity in the water column of the world's oceans, and the second largest component of biomass after prokaryotes, where up to 9x108 virions per millilitre have been found in microbial mats at the surface, and up to 70% of marine bacteria may be infected by phages.Phages have been used since the late 20th century as an alternative to antibiotics in the former Soviet Union and Central Europe, as well as in France. They are seen as a possible therapy against multi-drug-resistant strains of many bacteria (see phage therapy).
Phages are known to interact with the immune system both indirectly via bacterial expression of phage-encoded proteins and directly by influencing innate immunity and bacterial clearance.",1
Life Science,Pursuit predation,"Pursuit predation is a form of predation in which predators actively give chase to their prey, either solitarily or as a group.  It is an alternate predation strategy to ambush predation — pursuit predators rely on superior speed, endurance and/or teamwork to seize the prey, while ambush predators use stealth, luring, the use of surroundings and the element of surprise to capture the prey.  While the two patterns of predation are not mutually exclusive, morphological differences in an organism's body plan can create an evolutionary bias favoring either type of predation.
Pursuit predation is typically observed in carnivorous species within the kingdom Animalia, such as cheetahs, lions, wolves and early Homo species.  The chase can be initiated either by the predator, or by the prey if it is alerted to a predator's presence and attempt to flee before the predator gets close.  The chase ends either when the predator successfully catches up and tackles the prey, or when the predator abandons the attempt after the prey outruns it and escapes.
One particular form of pursuit predation is persistence hunting, where the predator stalks the prey slowly but persistently to wear it down physically with fatigue or overheating; some animals are examples of both types of pursuit.",1
Life Science,Phytogeomorphology,"Phytogeomorphology is the study of how terrain features affect plant growth. It was the subject of a treatise by Howard and Mitchell in 1985, who were considering the growth and varietal temporal and spatial variability found in forests, but recognized that their work also had application to farming, and the relatively new science (at that time) of precision agriculture.  The premise of Howard and Mitchell is that landforms, or features of the land's 3D topography significantly affect how and where plants (or trees in their case) grow.  Since that time, the ability to map and classify landform shapes and features has increased greatly.  The advent of GPS has made it possible to map almost any variable one might wish to measure.  Thus, a very increased awareness of the spatial variability of the environment that plants grow in has arisen.  The development of technology like airborne LiDAR has enabled the detailed measurement of landform features to better than sub-meter, and when combined with RTK-GPS (accuracies to 1mm) enables the creation of very accurate maps of where these features are.  Comparison of these landform maps with mapping of variables related to crop or plant growth show a strong correlation (see below for examples and references for precision agriculture).",1
Life Science,Biosemiotics,"Biosemiotics (from the Greek βίος bios, ""life"" and σημειωτικός sēmeiōtikos, ""observant of signs"") is a field of semiotics and biology that studies the prelinguistic meaning-making, or production and interpretation of signs and codes and their communication in the biological realm.Biosemiotics integrates the findings of biology and semiotics and proposes a paradigmatic shift in the scientific view of life, in which semiosis (sign process, including meaning and interpretation) is one of its immanent and intrinsic features. The term biosemiotic was first used by Friedrich S. Rothschild in 1962, but Thomas Sebeok and Thure von Uexküll have implemented the term and field. The field, which challenges normative views of biology, is generally divided between theoretical and applied biosemiotics.
Insights from biosemiotics have also been adopted in the humanities and social sciences, including human-animal studies and human-plant studies.",1
Life Science,Biomanufacturing,"Biomanufacturing is a type of manufacturing or biotechnology that utilizes biological systems to produce commercially important biomaterials and biomolecules for use in medicines, food and beverage processing, and industrial applications.  Biomanufacturing products are recovered from natural sources, such as blood, or from cultures of microbes, animal cells, or plant cells grown in specialized equipment.  The cells used during the production may have been naturally occurring or derived using genetic engineering techniques.

",1
Life Science,Biology,"Geology (from Ancient Greek  γῆ (gê) 'earth', and  -λoγία (-logía) 'study of, discourse') is a branch of natural science concerned with Earth and other astronomical objects, the features or rocks of which it is composed, and the processes by which they change over time. Modern geology significantly overlaps all other Earth sciences, including hydrology and the atmospheric sciences, and so is treated as one major aspect of integrated Earth system science and planetary science.
Geology describes the structure of the Earth on and beneath its surface, and the processes that have shaped that structure. It also provides tools to determine the relative and absolute ages of rocks found in a given location, and also to describe the histories of those rocks. By combining these tools, geologists are able to chronicle the geological history of the Earth as a whole, and also to demonstrate the age of the Earth. Geology provides the primary evidence for plate tectonics, the evolutionary history of life, and the Earth's past climates.
Geologists use a wide variety of methods to understand the Earth's structure and evolution, including field work, rock description, geophysical techniques, chemical analysis, physical experiments, and numerical modelling. In practical terms, geology is important for mineral and hydrocarbon exploration and exploitation, evaluating water resources, understanding of natural hazards, the remediation of environmental problems, and providing insights into past climate change. Geology is a major academic discipline, and it is central to geological engineering and plays an important role in geotechnical engineering.

",1
Life Science,Trace metal,"Trace metals are the metals subset of trace elements; that is, metals normally present in small but measurable amounts in animal and plant cells and tissues and that are a necessary part of nutrition and physiology. Many biometals are trace metals. Ingestion of, or exposure to, excessive quantities can be toxic. However, insufficient plasma or tissue levels of certain trace metals can cause pathology, as is the case with iron.
Trace metals within the human body include iron, lithium, zinc, copper, chromium, nickel, cobalt, vanadium, molybdenum, manganese and others.Trace metals are metals needed by living organisms to function properly and are depleted through the expenditure of energy by various metabolic processes of living organisms. They are replenished in animals through diet as well as environmental exposure, and in plants through the uptake of nutrients from the soil in which the plant grows. Human vitamin pills and plant fertilizers can be a source of trace metals.
Trace metals are sometimes referred to as trace elements, although the latter includes minerals and is a broader category. See also Dietary mineral. Trace elements are required by the body for specific functions. Things such as vitamins, sports drinks, fresh fruits and vegetables are sources. Taken in excessive amounts, trace elements can cause problems. For example fluorine is required for the formation of bones and enamel on teeth. However, when taken in an excessive amount can cause a disease called ""Fluorosis', in which bone deformations and yellowing of teeth are seen. Fluorine can occur naturally in some areas in ground water.
Trace metals include iron that can help to prevent anemia, and zinc that is a cofactor in over 100 enzyme reactions.",1
Life Science,Potassium spatial buffering,"Potassium spatial buffering is a mechanism for the regulation of extracellular potassium concentration by astrocytes. Other mechanisms for astrocytic potassium clearance are carrier-operated or channel-operated potassium chloride uptake.
The repolarization of neurons tends to raise potassium concentration in the extracellular fluid.  If a significant rise occurs, it will interfere with neuronal signaling by depolarizing neurons. Astrocytes have large numbers of potassium ion channels facilitating removal of potassium ions from the extracellular fluid. They are taken up at one region of the astrocyte and then distributed throughout the cytoplasm of the cell, and further to its neighbors via gap junctions. This keeps extracellular potassium at levels that prevent interference with normal propagation of an action potential.

",1
Life Science,Surfactant,"Surfactants are compounds that lower the surface tension (or interfacial tension) between two liquids, between a gas and a liquid, or between a liquid and a solid. Surfactants may act as detergents, wetting agents, emulsifiers, foaming agents, or dispersants.
The word ""surfactant"" is a blend of surface-active agent,
coined c.  1950.Agents that increase surface tension are ""surface active"" in the literal sense but are not called surfactants as their effect is opposite to the common meaning. A common example of surface tension increase is salting out: by adding an inorganic salt to an aqueous solution of a weakly polar substance, the substance will precipitate. The substance may itself be a surfactant – this is one  of the reasons why many surfactants are ineffective in sea water.",1
Life Science,Substantial equivalence,"In food safety, the concept of substantial equivalence holds that the safety of a new food, particularly one that has been genetically modified (GM), may be assessed by comparing it with a similar traditional food that has proven safe in normal use over time. It was first formulated as a food safety policy in 1993, by the Organisation for Economic Co-operation and Development (OECD).As part of a food safety testing process, substantial equivalence is the initial step, establishing toxicological and nutritional differences in the new food compared to a conventional counterpart—differences are analyzed and evaluated, and further testing may be conducted, leading to a final safety assessment.Substantial equivalence is the underlying principle in GM food safety assessment for a number of national and international agencies, including the Canadian Food Inspection Agency (CFIA), Japan's Ministry of Health, Labour and Welfare (MHLW), the US Food and Drug Administration (FDA), and the United Nations' Food and Agriculture Organization (FAO) and  World Health Organization.",1
Life Science,Intestine-on-a-chip,"Intestines-on-a-chip (gut-on-a-chip, mini-intestine) are microfluidic bioengineered 3D-models of the real organ, which better mimic physiological features than conventional 3D intestinal organoid culture... A variety of different intestine-on-a-chip models systems have been developed and refined, all holding their individual strengths and weaknesses and collectively holding great promise to the ultimate goal of establishing these systems as reliable high-throughput platforms for drug testing and personalised medicine. The intestine is a highly complex organ system performing a diverse set of vital tasks, from nutrient digestion and absorption, hormone secretion, and immunological processes to neuronal activity, which makes it particularly challenging to model in vitro.",1
Life Science,Fermentek,"Fermentek Ltd. is a biotechnological company in the Atarot industrial zone of Jerusalem, Israel. It specializes in the research, development and manufacture of biologically active, natural products isolated from microorganisms as well as from other natural sources such as plants and algae.
The main microorganisms used are nonpathogenic actinomycetes, Nocardia and Streptomycetes. The fungi used are: Penicillium, Aspergillus, Fusarium and the like. None of these is a human pathogen.
Fermentek does not sell to individuals. Most of its products are marketed through major international distributors specializing in chemicals, under their own brand names. Nevertheless, Fermentek has specific impact on the biochemical market, especially in the field of mycotoxins.
Mycotoxins are toxic compounds produced by molds in human food and farm animal feeds, thus being economically important factors. Fermentek manufactures an extensive line of pure mycotoxins used as standards in food analysis. In some cases, such as Aflatoxin M2, Fermentek supplies the entire world's requirements.In 2009, Fermentek announced a product family of highly standardized calibrant solutions of main mycotoxins. These are marketed under the brand name FermaSol. In 2010, it obtained ISO 13485 accreditation in connection with the production of starting materials for experimental drug production, and with manufacturing of reference standards of food contaminants.
None of Fermentek's products have been invented by it. Fermentek's aim is to make known compounds affordable to the scientific community.
Fermentek was founded by Dr. Yosef Behrend in 1994. It moved in 2004 to its new building, quadrupling its working space and greatly enlarging its manufacturing capacities.

",1
Life Science,Cell therapy,"Cell therapy (also called cellular therapy, cell transplantation, or cytotherapy) is a therapy in which viable cells are injected, grafted or implanted into a patient in order to effectuate a medicinal effect, for example, by transplanting T-cells capable of fighting cancer cells via cell-mediated immunity in the course of immunotherapy, or grafting stem cells to regenerate diseased tissues.
Cell therapy originated in the nineteenth century when scientists experimented by injecting animal material in an attempt to prevent and treat illness. Although such attempts produced no positive benefit, further research found in the mid twentieth century that human cells could be used to help prevent the human body rejecting transplanted organs, leading in time to successful bone marrow transplantation as has become common practice in treatment for patients that have compromised bone marrow after disease, infection, radiation or chemotherapy. In recent decades, however, stem cell and cell transplantation has gained significant interest by researchers as a potential new therapeutic strategy for a wide range of diseases, in particular for degenerative and immunogenic pathologies.",1
