category,page,text,label
Finance,Business valuation standard,"Business Valuation Standards (BVS) are codes of practice that are used in business valuation.  The major business appraisal standards are these:

CICBV Practice Standards. Published by the CBV Institute.
Uniform Standards of Professional Appraisal Practice (USPAP). Standards 9 and 10 cover business valuation and reporting standards. Published by the Appraisal Foundation.
International Valuation Standards. Published by the International Valuation Standards Council.
Statement on Standards for Valuation Services (SSVS No 1). Published by the American Institute of CPAs.In addition, each of the three major United States valuation societies — the American Society of Appraisers (ASA), American Institute of Certified Public Accountants (CPA/ABV), and the National Association of Certified Valuation Analysts (NACVA) — has its own set of Business Valuation Guidelines, which it requires all of its accredited members to adhere to.  The AICPA's standards are published as Statement on Standards for Valuation Services No.1 and the ASA's guidelines are published as the ASA Business Valuation Guidelines, which largely follow the USPAP Standard requirements.  All AICPA members are required to follow SSVS1.  Additionally, the majority of the State Accountancy Boards have adopted SSVS1 for CPAs licensed in their state.",3
Finance,Benjamin Graham formula,"The  Benjamin Graham formula is a formula proposed by investor and professor of Columbia University, Benjamin Graham, often referred to as the ""father of value investing"". Published in his book, The Intelligent Investor, Graham devised the formula for lay investors to help them with the valuation of growth stocks in vogue at the time of the formula's publication.
He did however caution that the use of this equation was not appropriate for companies ""below-par"" debt position: ""My advice to analysts would be to limit your appraisals to enterprises of investment quality, excluding from that category such as do not meet specific criteria of financial strength"".",3
Technology,Action model learning,"Action model learning (sometimes abbreviated action learning) is an area of machine learning concerned with creation and modification of software agent's knowledge about effects and preconditions of the actions that can be executed within its environment. This knowledge is usually represented in logic-based action description language and used as the input for automated planners.
Learning action models is important when goals change. When an agent acted for a while, it can use its accumulated knowledge about actions in the domain to make better decisions. Thus, learning action models differs from reinforcement learning. It enables reasoning about actions instead of expensive trials in the world. Action model learning is a form of inductive reasoning, where new knowledge is generated based on agent's observations. It differs from standard supervised learning in that correct input/output pairs are never presented, nor imprecise action models explicitly corrected.
Usual motivation for action model learning is the fact that manual specification of action models for planners is often a difficult, time consuming, and error-prone task (especially in complex environments).",2
Technology,Linear separability,"In Euclidean geometry, linear separability is a property of two sets of points. This is most easily visualized in two dimensions (the Euclidean plane) by thinking of one set of points as being colored blue and the other set of points as being colored red. These two sets are linearly separable if there exists at least one line in the plane with all of the blue points on one side of the line and all the red points on the other side. This idea immediately generalizes to higher-dimensional Euclidean spaces if the line is replaced by a hyperplane.
The problem of determining if a pair of sets is linearly separable and finding a separating hyperplane if they are, arises in several areas.  In statistics and machine learning, classifying certain types of data is a problem for which good algorithms exist that are based on this concept.

",2
Technology,Artificial intelligence in hiring,"Artificial intelligence (AI) in hiring involves the use of technology to automate aspects of the hiring process. Advances in artificial intelligence, such as the advent of machine learning and the growth of big data, enable AI to be utilized to recruit, screen, and predict the success of applicants. Proponents of artificial intelligence in hiring claim it reduces bias, assists with finding qualified candidates, and frees up human resource workers' time for other tasks, while opponents worry that AI perpetuates inequalities in the workplace and will eliminate jobs.

",2
Technology,Security Vision,"Security Vision – software meant for automation of information security management system (ISMS) organisation.
Software of this kind is a representative of security operations center (SOC).",2
Technology,Pwnie Awards,The Pwnie Awards recognize both excellence and incompetence in the field of information security. Winners are selected by a committee of security industry professionals from nominations collected from the information security community. The awards are presented yearly at the Black Hat Security Conference.,2
Technology,Enterprise information security architecture,"Enterprise information security architecture (ZBI) is a part of enterprise architecture focusing on information security throughout the enterprise.  The name implies a difference that may not exist between small/medium-sized businesses and larger organizations.

",2
Technology,Wargame (hacking),"In hacking, a wargame (or war game) is a cyber-security challenge and mind sport in which the competitors must exploit or defend a vulnerability in a system or application, or gain or prevent access to a computer system.A wargame usually involves a capture the flag logic, based on pentesting, semantic URL attacks, knowledge-based authentication, password cracking, reverse engineering of software (often JavaScript, C and assembly language), code injection, SQL injections, cross-site scripting, exploits, IP address spoofing, forensics, and other hacking techniques.",2
Technology,Content Threat Removal,"Content Threat Removal (CTR) is a cyber security technology intended to defeat the threat posed by handling digital content in cyberspace. Unlike other defences, including antivirus software and sandboxed execution, it does not rely on being able to detect threats. Similarly to Content Disarm and Reconstruction, CTR is designed to remove the threat without knowing whether it has done so, and acts without knowing if data contains a threat or not.
Detection strategies work by detecting unsafe content, and then blocking or removing that content. Content that is deemed safe is delivered to its destination. In contrast, Content Threat Removal assumes all data is hostile and delivers none of it to the destination, regardless of whether it is actually hostile. Although no data is delivered, the business information carried by the data is delivered, but using new data created for the purpose.

",2
Technology,Multilinear principal component analysis,"Within statistics, Multilinear principal component analysis (MPCA)  is a multilinear extension of principal component analysis (PCA). MPCA is employed in the analysis of n-way arrays, i.e. a cube or hyper-cube of numbers, also informally referred to as a ""data tensor"".  N-way arrays may be decomposed, analyzed, or modeled by 

linear tensor models such as CANDECOMP/Parafac, or
multilinear tensor models, such as multilinear principal component analysis (MPCA), or multilinear independent component analysis (MICA), etc.The origin of MPCA can be traced back to the Tucker decomposition and Peter Kroonenberg's ""M-mode PCA/3-mode PCA"" work. In 2000, De Lathauwer et al. restated Tucker and Kroonenberg's work in clear and concise numerical computational terms in their SIAM paper entitled ""Multilinear Singular Value Decomposition"", (HOSVD) and in their paper ""On the Best Rank-1 and Rank-(R1, R2, ..., RN ) Approximation of Higher-order Tensors"".Circa 2001, Vasilescu reframed the data analysis, recognition and synthesis problems as multilinear tensor problems based on the insight that most observed data are the compositional consequence of several causal factors of data formation, and are well suited for multi-modal data tensor analysis.  The power of the tensor framework was showcased by analyzing human motion joint angles, facial images or textures in terms of their causal factors of data formation in the following works: Human Motion Signatures
(CVPR 2001, ICPR 2002), face recognition – TensorFaces,
(ECCV 2002, CVPR 2003, etc.) and computer graphics – TensorTextures (Siggraph 2004).
Historically, MPCA has been referred to as ""M-mode PCA"", a terminology which was coined by Peter Kroonenberg in 1980. In 2005, Vasilescu and Terzopoulos introduced the Multilinear PCA terminology as a way to better differentiate between linear and multilinear tensor decomposition, as well as, to better differentiate between the work that computed 2nd order statistics associated with each data tensor mode(axis), and subsequent work on Multilinear Independent Component Analysis that computed higher order statistics associated with each tensor mode/axis.
Multilinear PCA may be applied to compute the causal factors of data formation, or as signal processing tool on data tensors whose individual observation have either been vectorized, or whose observations are treated as matrix and concatenated into a data tensor.
MPCA computes a set of orthonormal matrices associated with each mode of the data tensor which are analogous to the orthonormal row and column space of a matrix computed by the matrix SVD.  This transformation aims to capture as high a variance as possible, accounting for as much of the variability in the data associated with each data tensor mode(axis).

",2
Technology,Bag-of-words model,"The bag-of-words model is a simplifying representation used in natural language processing and information retrieval (IR). In this model, a text (such as a sentence or a document) is represented as the bag (multiset) of its words, disregarding grammar and even word order but keeping multiplicity. The bag-of-words model has also been used for computer vision.The bag-of-words model is commonly used in methods of document classification where the (frequency of) occurrence of each word is used as a feature for training a classifier.An early reference to ""bag of words"" in a linguistic context can be found in Zellig Harris's 1954 article on Distributional Structure.The Bag-of-words model is one example of a Vector space model.

",2
Technology,Security breach notification laws,"Security breach notification laws or data breach notification laws are laws that require individuals or entities affected by a data breach, unauthorized access to data, to notify their customers and other parties about the breach, as well as take specific steps to remedy the situation based on state legislature. Data breach notification laws have two main goals. The first goal is to allow individuals a chance to mitigate risks against data breaches. The second goal is to promote company incentive to strengthen data security.Together, these goals work to minimize consumer harm from data breaches, including impersonation, fraud, and identity theft.Such laws have been irregularly enacted in all 50 U.S. states since 2002. Currently, all 50 states have enacted forms of data breach notification laws. It should be noted though, that there is no federal data breach notification law, despite previous legislative attempts. These laws were enacted in response to an escalating number of breaches of consumer databases containing personally identifiable information. Similarly, multiple other countries, like the European Unions's General Data Protection Regulation (GDPR) and Australia's Privacy Amendment (Notifiable Data Breaches) Act 2017 (Cth), have added data breach notification laws to combat the increasing occurrences of data breaches.The rise in data breaches conducted by both countries and individuals is evident and alarming, as the number of reported data breaches has increased from 421 in 2011, to 1,091 in 2016, and 1,579 in 2017 according to the Identity Theft Resource Center (ITRC). It has also impacted millions of people and gained increasing public awareness due to large data breaches such as the October 2017 Equifax breach that exposed almost 146 million individual's personal information.

",2
Technology,Systems development life cycle,"In systems engineering, information systems and software engineering, the systems development life cycle (SDLC), also referred to as the application development life-cycle, is a process for planning, creating, testing, and deploying an information system. The systems development life cycle concept applies to a range of hardware and software configurations, as a system can be composed of hardware only, software only, or a combination of both. There are usually six stages in this cycle: requirement analysis, design, development and testing, implementation, documentation, and evaluation.",2
Technology,Stochastic block model,"The stochastic block model is a generative model for random graphs. This model tends to produce graphs containing communities, subsets of nodes characterized by being connected with one another with particular edge densities. For example, edges may be more common within communities than between communities. Its mathematical formulation has been firstly introduced in 1983 in the field of social network by Holland et al. The stochastic block model is important in statistics, machine learning, and network science, where it serves as a useful benchmark for the task of recovering community structure in graph data.

",2
Technology,Weak supervision,"Weak supervision is a branch of machine learning where noisy, limited, or imprecise sources are used to provide supervision signal for labeling large amounts of training data in a supervised learning setting. This approach alleviates the burden of obtaining hand-labeled data sets, which can be costly or impractical. Instead, inexpensive weak labels are employed with the understanding that they are imperfect, but can nonetheless be used to create a strong predictive model.

",2
Technology,Representer theorem,"For computer science, in statistical learning theory, a representer theorem is any of several related results stating that a minimizer 
  
    
      
        
          f
          
            ∗
          
        
      
    
    {\displaystyle f^{*}}
   of a regularized empirical risk functional defined over a reproducing kernel Hilbert space can be represented as a finite linear combination of kernel products evaluated on the input points in the training set data.",2
Technology,Anomaly detection,"In data analysis, anomaly detection (also referred to as outlier detection and sometimes as novelty detection) is generally understood to be the identification of rare items, events or observations which deviate significantly from the majority of the data and do not conform to a well defined notion of normal behaviour. Such examples may arouse suspicions of being generated by a different mechanism, or appear inconsistent with the remainder of that set of data.Anomaly detection finds application in many domains including cyber security, medicine, machine vision, statistics, neuroscience, law enforcement and financial fraud to name only a few. Anomalies were initially searched for clear rejection or omission from the data to aid statistical analysis, for example to compute the mean or standard deviation. They were also removed to better predictions from models such as linear regression, and more recently their removal aids the performance of machine learning algorithms. However, in many applications anomalies themselves are of interest and are the observations most desirous in the entire data set, which need to be identified and separated from noise or irrelevant outliers.
Three broad categories of anomaly detection techniques exist. Supervised anomaly detection techniques require a data set that has been labeled as ""normal"" and ""abnormal"" and involves training a classifier. However, this approach is rarely used in anomaly detection due to the general unavailability of labelled data and the inherent unbalanced nature of the classes. Semi-supervised anomaly detection techniques assume that some portion of the data is labelled. This may be any combination of the normal or anomalous data, but more often than not the techniques construct a model representing normal behavior from a given normal training data set, and then test the likelihood of a test instance to be generated by the model. Unsupervised anomaly detection techniques assume the data is unlabelled and are by far the most commonly used due to their wider and relevant application.

",2
Technology,BlueBorne (security vulnerability),"BlueBorne is a type of security vulnerability with Bluetooth implementations in Android, iOS, Linux and Windows. It affects many electronic devices such as laptops, smart cars, smartphones and wearable gadgets. One example is CVE-2017-14315.  The vulnerabilities were first reported by Armis, an IoT security firm, on 12 September 2017. According to Armis, ""The BlueBorne attack vector can potentially affect all devices with Bluetooth capabilities, estimated at over 8.2 billion devices today [2017].""",2
Technology,Natarajan dimension,"In the theory of Probably Approximately Correct Machine Learning, the Natarajan dimension characterizes the complexity of learning a set of functions, generalizing from the Vapnik-Chervonenkis dimension for boolean functions to multi-class functions. Originally introduced as the Generalized Dimension by Natarajan, it was subsequently renamed the Natarajan Dimension by Haussler and Long.",2
Technology,Formal concept analysis,"In information science, formal concept analysis (FCA) is a principled way of deriving a concept hierarchy or formal ontology from a collection of objects and their properties. Each concept in the hierarchy represents the objects sharing some set of properties; and each sub-concept in the hierarchy represents a subset of the objects (as well as a superset of the properties) in the concepts above it. The term was introduced by Rudolf Wille in 1981, and builds on the mathematical theory of lattices and ordered sets that was developed by Garrett Birkhoff and others in the 1930s.
Formal concept analysis finds practical application in fields including data mining, text mining, machine learning, knowledge management, semantic web, software development, chemistry and biology.",2
Technology,Intrusion tolerance,"Intrusion tolerance is a fault-tolerant design approach to defending information systems against malicious attacks. In that sense, it is also a computer security approach. Abandoning the conventional aim of preventing all intrusions, intrusion tolerance instead calls for triggering mechanisms that prevent intrusions from leading to a system security failure. There are two major variants of intrusion tolerance mechanisms: mechanisms based on redundancy (e.g., as in Byzantine fault tolerance); mechanisms based on intrusion detection (e.g., with an intrusion detection system) and reaction.",2
Technology,CloudPassage,"CloudPassage is a company that provides an automation platform, delivered via software as a service, that improves security for private, public, and hybrid cloud computing environments. CloudPassage is headquartered in San Francisco.

",2
Technology,Enrollment over Secure Transport,"The Enrollment over Secure Transport, or EST is a cryptographic protocol that describes an X.509 certificate management protocol targeting public key infrastructure (PKI) clients that need to acquire client certificates and associated certificate authority (CA) certificates. EST is described in RFC 7030. EST has been put forward as a replacement for SCEP, being easier to implement on devices already having an HTTPS stack. EST uses HTTPS as transport and leverages TLS for many of its security attributes. EST has described standardized URLs and uses the well-known Uniform Resource Identifiers (URIs) definition codified in RFC 5785.",2
Technology,Latent space,"A latent space, also known as a latent feature space or embedding space, is an embedding of a set of items within a manifold in which items which resemble each other more closely are positioned closer to one another in the latent space. Position within the latent space can be viewed as being defined by a set of latent variables that emerge from the resemblances from the objects.
In most cases, the dimensionality of the latent space is chosen to be lower than the dimensionality of the feature space from which the data points are drawn, making the construction of a latent space an example of dimensionality reduction, which can also be viewed as a form of data compression or machine learning.
A number of algorithms exist to create latent space embeddings given a set of data items and a similarity function.

",2
Technology,Active learning (machine learning),"Active learning is a special case of machine learning in which a learning algorithm can interactively query a user (or some other information source) to label new data points with the desired outputs. In statistics literature, it is sometimes also called optimal experimental design. The information source is also called teacher or oracle.
There are situations in which unlabeled data is abundant but manual labeling is expensive. In such a scenario, learning algorithms can actively query the user/teacher for labels. This type of iterative supervised learning is called active learning. Since the learner chooses the examples, the number of examples to learn a concept can often be much lower than the number required in normal supervised learning. With this approach, there is a risk that the algorithm is overwhelmed by uninformative examples.  Recent developments are dedicated to multi-label active learning, hybrid active learning and active learning in a single-pass (on-line) context, combining concepts from the field of machine learning (e.g. conflict and ignorance) with adaptive, incremental learning policies in the field of online machine learning.

",2
Technology,Security hacker,"A security hacker is someone who explores methods for breaching defenses and exploiting weaknesses in a computer system or network. Hackers may be motivated by a multitude of reasons, such as profit, protest, information gathering, challenge, recreation, or evaluation of a system weaknesses to assist in formulating defenses against potential hackers. The subculture that has evolved around hackers is often referred to as the ""computer underground"".Longstanding controversy surrounds the meaning of the term ""hacker"". In this controversy, computer programmers reclaim the term hacker, arguing that it refers simply to someone with an advanced understanding of computers and computer networks and that cracker is the more appropriate term for those who break into computers, whether computer criminals (black hats) or computer security experts (white hats). A 2014 article noted that ""the black-hat meaning still prevails among the general public"".",2
Technology,Biometric device,"A biometric device is a security identification and authentication device.  Such devices use automated methods of verifying or recognising the identity of a living person based on a physiological  or behavioral characteristic. These characteristics include fingerprints, facial images, iris and voice recognition.

",2
Technology,Cyber Threat Intelligence Integration Center,"The Cyber Threat Intelligence Integration Center (CTIIC) is a new United States federal government agency that will be a fusion center between existing agencies and the private sector for real-time use against cyber attacks. CTIIC was created due to blocked efforts in Congress that were stymied over liability and privacy concerns of citizens.CTIIC was formally announced by Lisa Monaco February 10, 2015 at the Wilson Center. The agency will be within the Office of the Director of National Intelligence.",2
Technology,Leakage (machine learning),"In statistics and machine learning, leakage (also known as data leakage or target leakage) is the use of information in the model training process which would not be expected to be available at prediction time, causing the predictive scores (metrics) to overestimate the model's utility when run in a production environment.Leakage is often subtle and indirect, making it hard to detect and eliminate. Leakage can cause a statistician or modeler to select a suboptimal model, which could be outperformed by a leakage-free model.",2
