category,page,text,label
Finance,Morningstar Style Box,"The Morningstar Style Box is a grid of nine squares used to identify the investment style of stocks and mutual funds. Developed by Don Phillips and John Rekenthaler, the Style Box was launched in 1992.The vertical axis of the Style Box represents an investment's size category: small, mid and large. The horizontal axis depicts fund investment style categories such as ""value"" and ""growth,"" which are common to stocks and funds. The ""blend"" definition in the central column differs for stocks and funds. “For stocks, the central column of the Style Box will represent the core style (those for which neither value or growth characteristics dominate); for funds, it will represent the blend style (a mixture of growth and value stocks or mostly core stocks).”",3
Finance,Master of Finance,"The Master of Finance is a master's degree awarded by universities or graduate schools preparing students for careers in finance. The degree is often titled Master in Finance (abbreviated M.Fin., MiF, MFin), or Master of Science in Finance (MSF in North America, and MSc in Finance in the UK and Europe).  In the U.S. and Canada the program may be positioned as a professional degree.  Particularly in Australia, the degree may be offered as a Master of Applied Finance (MAppFin). In some cases, the degree is offered as a Master of Management in Finance (MMF). More specifically focused and titled degrees are also offered.

",3
Finance,Financial close management,"Financial close management (FCM) is a recurring process in management accounting by which accounting teams verify and adjust account balances at the end of a designated period in order to produce financial reports representative of the company's true financial position to inform stakeholders such as management, investors, lenders, and regulatory agencies.

",3
Finance,Austerity,"Austerity is a set of political-economic policies that aim to reduce government budget deficits through spending cuts, tax increases, or a combination of both. There are three primary types of austerity measures: higher taxes to fund spending, raising taxes while cutting spending, and lower taxes and lower government spending. Austerity measures are often used by governments that find it difficult to borrow or meet their existing obligations to pay back loans. The measures are meant to reduce the budget deficit by bringing government revenues closer to expenditures. Proponents of these measures state that this reduces the amount of borrowing required and may also demonstrate a government's fiscal discipline to creditors and credit rating agencies and make borrowing easier and cheaper as a result.
In most macroeconomic models, austerity policies which reduce government spending lead to increased unemployment in the short term. These reductions in employment usually occur directly in the public sector and indirectly in the private sector. Where austerity policies are enacted using tax increases, these can reduce consumption by cutting household disposable income. Reduced government spending can reduce GDP growth in the short term as government expenditure is itself a component of GDP. In the longer term, reduced government spending can reduce GDP growth if, for example, cuts to education spending leave a country's workforce less able to do high-skilled jobs or if cuts to infrastructure investment impose greater costs on business than they saved through lower taxes. In both cases, if reduced government spending leads to reduced GDP growth, austerity may lead to a higher debt-to-GDP ratio than the alternative of the government running a higher budget deficit. In the aftermath of the Great Recession, austerity measures in many European countries were followed by rising unemployment and slower GDP growth. The result was increased debt-to-GDP ratios despite reductions in budget deficits.Theoretically in some cases, particularly when the output gap is low, austerity can have the opposite effect and stimulate economic growth. For example, when an economy is operating at or near capacity, higher short-term deficit spending (stimulus) can cause interest rates to rise, resulting in a reduction in private investment, which in turn reduces economic growth. Where there is excess capacity, the stimulus can result in an increase in employment and output. Alberto Alesina, Carlo Favero, and Francesco Giavazzi argue that austerity can be expansionary in situations where government reduction in spending is offset by greater increases in aggregate demand (private consumption, private investment, and exports).",3
Finance,Accounting period,"An accounting period, in bookkeeping, is the period with reference to which management accounts and financial statements are prepared. 
In management accounting the accounting period varies widely and is determined by management. Monthly accounting periods are common.
In financial accounting the accounting period is determined by regulation and is usually 12 months. The beginning of the accounting period differs according to jurisdiction. For example, one entity may follow the calendar year, January to December, while another may follow April to March as the accounting period.
The International Financial Reporting Standards allow a period of 52 weeks as an accounting period instead of 12 months.  This method is known as the 4-4-5 calendar in British and Commonwealth usage and the 52–53-week fiscal year in the United States.  In the United States the method is permitted by generally accepted accounting principles, as well as by US Internal Revenue Code Regulation 1.441-2  (IRS Publication 538).In some of the ERP tools there are more than 12 accounting periods in a financial year. They put one accounting period as ""Year Open"" period where all the carried over balances from last financial year are cleared and one period as ""Year Close"" where all the transactions for closed for the same financial year. Older systems sometimes called these periods ""Month 0"" and ""Month 13"".",3
Finance,Value-in-use,"Use value (German: Gebrauchswert) or value in use is a concept in Marxist economics. It refers to the tangible features of a commodity (a tradeable object) which can satisfy some human requirement, want or need, or which serves a useful purpose. In Karl Marx's critique of political economy, any product has a labor-value and a use-value, and if it is traded as a commodity in markets, it additionally has an exchange value, most often expressed as a money-price.Marx acknowledges that commodities being traded also have a general utility, implied by the fact that people want them, but he argues that this by itself says nothing about the specific character of the economy in which they are produced and sold.",3
Finance,Undervalued stock,"An undervalued stock is defined as a stock that is selling at a price significantly below what is assumed to be its intrinsic value. For example, if a stock is selling for $50, but it is worth $100 based on predictable future cash flows, then it is an undervalued stock. The undervalued stock has the intrinsic value below the investment's true intrinsic value.  
Numerous popular books discuss undervalued stocks. Examples are The Intelligent Investor by Benjamin Graham, also known as ""The Dean of Wall Street,"" and The Warren Buffett Way by Robert Hagstrom. The Intelligent Investor puts forth Graham's principles that are based on mathematical calculations such as the price/earning ratio. He was less concerned with the qualitative aspects of a business such as the nature of a business, its growth potential and its management. For example, Amazon, Facebook, Netflix and Tesla in 2016, although they had a promising future, would not have appealed to Graham, since their price-earnings ratios were too high. Graham's ideas had a significant influence on the young Warren Buffett, who later became a famous US billionaire.

",3
Finance,Appraisal Institute,"The Appraisal Institute (AI), headquartered in Chicago, Illinois, is an international association of professional real estate appraisers. It was founded in January 1991 when the American Institute of Real Estate Appraisers (AIREA) and the Society of Residential Appraisers merged. The AIREA and the Society were respectively founded in 1932 and 1935. Real estate appraisal emerged as a profession at this point in response to the crash of home values as a result of the Great Depression, building on the intellectual frameworks developed over the course of the 1920s by land value theorists like Ernest McKinley Fisher, Frederick Babcock, Homer Hoyt, and Richard T. Ely. As of February 2007, the Appraisal Institute has more than 21,000 members and 99 chapters throughout the United States, Canada, and overseas.
The group publishes the Appraisal Journal.",3
Finance,Graham number,"Graham's number is an immense number that arose as an upper bound on the answer of a problem in the mathematical field of Ramsey theory. It is much larger than many other large numbers such as Skewes's number and Moser's number, both of which are in turn much larger than a googolplex. As with these, it is so large that the observable universe is far too small to contain an ordinary digital representation of Graham's number, assuming that each digit occupies one Planck volume, possibly the smallest measurable space. But even the number of digits in this digital representation of Graham's number would itself be a number so large that its digital representation cannot be represented in the observable universe.  Nor even can the number of digits of that number—and so forth, for a number of times far exceeding the total number of Planck volumes in the observable universe. Thus Graham's number cannot be expressed even by physical universe-scale power towers of the form 
  
    
      
        
          a
          
            
              b
              
                
                  c
                  
                    
                      ⋅
                      
                        
                          ⋅
                          
                            ⋅
                          
                        
                      
                    
                  
                
              
            
          
        
      
    
    {\displaystyle a^{b^{c^{\cdot ^{\cdot ^{\cdot }}}}}}
  .
However, Graham's number can be explicitly given by computable recursive formulas using Knuth's up-arrow notation or equivalent, as was done by Graham.  As there is a recursive formula to define it, it is much smaller than typical busy beaver numbers.  Though too large to be computed in full, the sequence of digits of Graham's number can be computed explicitly through simple algorithms; the last thirteen digits are ...7262464195387.  With Knuth's up-arrow notation, Graham's number is 
  
    
      
        
          g
          
            64
          
        
      
    
    {\displaystyle g_{64}}
  , where

Graham's number is named after the American mathematician Ronald Graham, who used the number in conversations with popular science writer Martin Gardner as a simplified explanation of the upper bounds of the problem he was working on. In 1977, Gardner described the number in Scientific American, introducing it to the general public.  At the time of its introduction, it was the largest specific positive integer ever to have been used in a published mathematical proof.  The number was described in the 1980 Guinness Book of World Records, adding to its popular interest.  Other specific integers (such as TREE(3)) known to be far larger than Graham's number have since appeared in many serious mathematical proofs, for example in connection with Harvey Friedman's various finite forms of Kruskal's theorem. Additionally, smaller upper bounds on the Ramsey theory problem from which Graham's number derived have since been proven to be valid.

",3
Finance,Liquidation value,"Liquidation value is the likely price of an asset when it is allowed insufficient time to sell on the open market, thereby reducing its exposure to potential buyers. Liquidation value is typically lower than fair market value. Unlike cash or securities, certain illiquid assets, like real estate, often require a period of several months in order to obtain their fair market value in a sale, and will generally sell for a significantly lower price if a sale is forced to occur in a shorter time period. The liquidation value may be either the result of a forced liquidation or an orderly liquidation. Either value assumes that the sale is consummated by a seller who is compelled to sell and assumes an exposure period which is less than market normal.
The most common definition used by real estate appraisers is as followsThe most probable price that a specified interest in real property is
likely to bring under all of the following conditions:

Consummation of a sale will occur within a severely limited future marketing period specified by the client.
The actual market conditions currently prevailing are those to which the appraised property interest is subject.
The buyer is acting prudently and knowledgeably.
The seller is under extreme compulsion to sell.
The buyer is typically motivated.
The buyer is acting in what he or she considers his or her best interest.
A limited marketing effort and time will be allowed for the completion of a sale.
Payment will be made in cash in U.S. dollars or in terms of financial arrangements comparable thereto.
The price represents the normal consideration for the property sold, unaffected by special or creative financing or sales concessions granted by anyone associated with the sale.Note that this definition differs from the most commonly used definitions of market value or fair market value.

",3
Finance,Intermediated research,"In finance, intermediated research is a type of fundamental analysis or investment analysis of a business to establish its value for investors that attempts to avoid commercial pressure or influence.
Many banks and brokers provide research to the investment community, however this form of research suffers from a real or perceived lack of objectivity. For example, this research may be subject to influence from within a bank from, say, investment bankers keen to win company’s IPO mandate.
An alternative form is known as independent research or alternative research, this is research that is not provided by a bank or broker. However, someone has to fund the costs of conducting the research, and when the funder is the company being researched, this form of independent research is termed “sponsored” or “company-paid” research. Unfortunately, with the subject company paying directly for these services, this form of research suffers from a real or perceived lack of objectivity, which reduces its value to investors and hence to the companies themselves.
Intermediated research improves significantly upon the sponsored research model, by introducing important safeguards into the commercial and research process framework. The key structure is that the company has no choice in its allocation to a research provider; once matched with the research provider, the company is under a long term contract in order to minimize commercial pressure or influence; and the fees paid to the research provider are not sufficiently material for the company to be able to exert any influence over the content or conclusions of the research report. Collectively, these measures enhance the value of the report to investors and consequently, to the company itself.
The intermediated research framework includes the further protections; ensuring that the independent research firms involved have no investment banking or brokerage operations in their business models; conduct no traditional company-paid research; deliver a standard template for analysis of every company so that all standard topics are covered; and avoiding ratings and target prices in the reports, since these can risk becoming a focus of pressure exerted on the research provider by the subject company.",3
Finance,Book value,"In accounting, book value  is the value of an asset according to its balance sheet account balance. For assets, the value is based on the original cost of the asset less any depreciation, amortization or impairment costs made against the asset. Traditionally, a company's book value is its total assets minus intangible assets and liabilities. However, in practice, depending on the source of the calculation, book value may variably include goodwill, intangible assets, or both. The value inherent in its workforce, part of the intellectual capital of a company, is always ignored.  When intangible assets and goodwill are explicitly excluded, the metric is often specified to be ""tangible book value"".
In the United Kingdom, the term net asset value may refer to the book value of a company.",3
Finance,Film finance,"Film finance is an aspect of film production that occurs during the development stage prior to pre-production, and is concerned with determining the potential value of a proposed film. 
In the United States, the value is typically based on a forecast of revenues (generally 10 years for films and 20 years for television shows), beginning with theatrical release, and including DVD sales, and release to cable broadcast television networks both domestic and international and inflight airline licensing.",3
Finance,Renu Sud Karnad,"Renu Sud Karnad is an Indian businesswoman and the managing director of India's largest private sector bank Housing Development Finance Corp. Ltd. Additionally she also holds seven other positions for companies like HDFC Property Ventures Ltd., HDFC Education & Development Services Pvt Ltd. (both are subsidiaries of HDFC Ltd.) and Non-Executive Chairman at GlaxoSmithKline Pharmaceuticals Ltd. She is also the Vice Chairman-Governing Council at Indraprastha Cancer Society and Research Centre and part of the board of 17 other companies.",3
Finance,Period of financial distress,"A period of financial distress occurs when the price of a company or an asset or an index of a set of assets in a market is declining with the danger of a sudden crash of value occurring, either because the company is experiencing increasing problems of cash flow or a deteriorating credit balance or because the price had become too high as a result of a speculative bubble that has now peaked.",3
Finance,Turnaround stock,A turnaround stock is a share with a high P/E ratio but low price-to-book ratio.,3
Finance,Total value of ownership,"Total value of ownership (TVO) or total value of opportunity, is a methodology of measuring and analyzing the business value of IT investments. Gartner Group designed this methodology in 2003.TVO differs from total cost of ownership (TCO) in that TVO considers the benefits of alternative investments. It is a comparative measurement that evaluates the TCO and any additional benefits, such as the mobility of laptops when compared to desktop computers.",3
Finance,Accounting entity,"An Accounting Entity is simply an Entity for which accounting records are to be kept.
The main requirements for something to be considered an ""accounting entity"" are:

It can own property the value of which can be measured in financial terms
It can incur debts or liabilities which can also be measured in financial terms
It can therefore be assigned a value for its net worth or solvency which is the difference between the twoExamples of accounting entities include corporations, clubs, trusts, partnerships and individuals.",3
Finance,Portal:Banks,"The human back, also called the dorsum, is the large posterior area of the human body, rising from the top of the buttocks to the back of the neck. It is the surface of the body opposite from the chest and the abdomen. The vertebral column runs the length of the back and creates a central area of recession. The breadth of the back is created by the shoulders at the top and the pelvis at the bottom.
Back pain is a common medical condition, generally benign in origin.",3
Finance,Asset,"In financial accounting, an asset is any resource owned or controlled by a business or an economic entity. It is anything (tangible or intangible) that can be used to produce positive economic value. Assets represent value of ownership that can be converted into cash (although cash itself is also considered an asset).
The balance sheet of a firm records the monetary value of the assets owned by that firm. It covers money and other valuables belonging to an individual or to a business.Assets can be grouped into two major classes: tangible assets and intangible assets. Tangible assets contain various subclasses, including current assets and fixed assets. Current assets include cash, inventory, accounts receivable, while fixed assets include land, buildings and equipment.
Intangible assets are non-physical resources and rights that have a value to the firm because they give the firm an advantage in the marketplace. Intangible assets include goodwill, copyrights, trademarks, patents, computer programs, and financial assets, including financial investments, bonds, and stocks.

",3
Finance,Audit technology,"An information technology audit, or information systems audit, is an examination of the management controls within an Information technology (IT) infrastructure and business applications. The evaluation of evidence obtained determines if the information systems are safeguarding assets, maintaining data integrity, and operating effectively to achieve the organization's goals or objectives. These reviews may be performed in conjunction with a financial statement audit, internal audit, or other form of attestation engagement.
IT audits are also known as automated data processing audits (ADP audits) and computer audits.
They were formerly called electronic data processing audits (EDP audits).

",3
Finance,Financial analysis,"Financial analysis (also referred to as financial statement analysis or accounting analysis or Analysis of finance) refers to an assessment of the viability, stability, and profitability of a business, sub-business or project. 
It is performed by professionals who prepare reports using ratios and other techniques, that make use of information taken from financial statements and other reports. These reports are usually presented to top management as one of their bases in making business decisions.  
Financial analysis may determine if a business will:

Continue or discontinue its main operation or part of its business;
Make or purchase certain materials in the manufacture of its product;
Acquire or rent/lease certain machineries and equipment in the production of its goods;
Issue  shares or negotiate for a bank loan to increase its working capital;
Make decisions regarding investing or lending capital;
Make other decisions that allow management to make an informed selection on various alternatives in the conduct of its business.",3
Finance,Investment value,"Investment value is the value of a property to a particular investor.  In the U.S. and U.K., it is equal to market value for the investor who has the capacity to put the property to good use—its highest-and-best-use, its most valuable use. For other investors with limited capacity or vision, investment value is lower because they cannot put the property to use in a way that is maximally productive.",3
Finance,Terminal value (finance),"In finance, the terminal value (also known as “continuing value” or “horizon value” or ""TV"") of a security is the present value at a future point in time of all future cash flows when we expect stable growth rate forever. It is most often used in multi-stage discounted cash flow analysis, and allows for the limitation of cash flow projections to a several-year period; see Forecast period (finance). 
Forecasting results beyond such a period is impractical and exposes such projections to a variety of risks limiting their validity, primarily the great uncertainty involved in predicting industry and macroeconomic conditions beyond a few years.
Thus, the terminal value allows for the inclusion of the value of future cash flows occurring beyond a several-year projection period while satisfactorily mitigating many of the problems of valuing such cash flows. 
The terminal value is calculated in accordance with a stream of projected future free cash flows in discounted cash flow analysis. 
For whole-company valuation purposes, there are two methodologies used to calculate the Terminal Value.",3
